[
  {
    "topic": "culture",
    "topic_name": "Культура и медиа",
    "question_set": "culture-rotation-1",
    "question_set_title": "Культурный сет 1",
    "prompt": "Культура 01",
    "stmt_a": "Шекспир написал трагедию «Гамлет».",
    "stmt_b": "Театр Глобус находился в Лондоне.",
    "stmt_c": "Роман «Война и мир» создан в древнем Египте.",
    "lie_option": "C",
    "explanation": "Роман Толстого появился в XIX веке в России.",
    "correct_fact": "«Война и мир» написал Лев Толстой в XIX веке.",
    "trap_type": "timeline",
    "difficulty": 1,
    "source_url": null
  },
  {
    "topic": "culture",
    "topic_name": "Культура и медиа",
    "question_set": "culture-rotation-1",
    "question_set_title": "Культурный сет 1",
    "prompt": "Культура 02",
    "stmt_a": "Импрессионисты искали новые способы передачи света.",
    "stmt_b": "Клод Моне писал серию «Кувшинок».",
    "stmt_c": "Импрессионизм зародился в космосе на Марсе.",
    "lie_option": "C",
    "explanation": "Направление возникло во Франции в XIX веке.",
    "correct_fact": "Импрессионизм зародился в Париже.",
    "trap_type": "scope_shift",
    "difficulty": 1,
    "source_url": null
  },
  {
    "topic": "culture",
    "topic_name": "Культура и медиа",
    "question_set": "culture-rotation-1",
    "question_set_title": "Культурный сет 1",
    "prompt": "Культура 03",
    "stmt_a": "Джаз сформировался в США.",
    "stmt_b": "Импровизация — важная часть джаза.",
    "stmt_c": "Джаз появился благодаря звуку вулканов без участия людей.",
    "lie_option": "C",
    "explanation": "Жанр возник из афроамериканских традиций.",
    "correct_fact": "Джаз возник в человеческих музыкальных сообществах.",
    "trap_type": "origin",
    "difficulty": 1,
    "source_url": null
  },
  {
    "topic": "culture",
    "topic_name": "Культура и медиа",
    "question_set": "culture-rotation-1",
    "question_set_title": "Культурный сет 1",
    "prompt": "Культура 04",
    "stmt_a": "Кинематограф Люмира запустил эпоху кино.",
    "stmt_b": "Первые фильмы были немыми.",
    "stmt_c": "Звук в кино появился сразу в 1895 году.",
    "lie_option": "C",
    "explanation": "Звуковое кино появилось только в конце 1920-х.",
    "correct_fact": "Первые десятилетия кино были немыми.",
    "trap_type": "timeline",
    "difficulty": 1,
    "source_url": null
  },
  {
    "topic": "culture",
    "topic_name": "Культура и медиа",
    "question_set": "culture-rotation-1",
    "question_set_title": "Культурный сет 1",
    "prompt": "Культура 05",
    "stmt_a": "Сальвадор Дали представлял сюрреализм.",
    "stmt_b": "Картина «Постоянство памяти» изображает плавящиеся часы.",
    "stmt_c": "Сюрреализм появился как военный устав.",
    "lie_option": "C",
    "explanation": "Сюрреализм — художественное направление.",
    "correct_fact": "Направление возникло в искусстве, а не в армии.",
    "trap_type": "scope_shift",
    "difficulty": 1,
    "source_url": null
  },
  {
    "topic": "culture",
    "topic_name": "Культура и медиа",
    "question_set": "culture-rotation-1",
    "question_set_title": "Культурный сет 1",
    "prompt": "Культура 06",
    "stmt_a": "Хокку — японская поэтическая форма.",
    "stmt_b": "Мацуо Басё прославился хокку.",
    "stmt_c": "Хокку состоит из 20 строк и рифмованных куплетов.",
    "lie_option": "C",
    "explanation": "Классическое хокку содержит 3 строки (5-7-5 слогов).",
    "correct_fact": "Форма хокку краткая.",
    "trap_type": "definition",
    "difficulty": 1,
    "source_url": null
  },
  {
    "topic": "culture",
    "topic_name": "Культура и медиа",
    "question_set": "culture-rotation-1",
    "question_set_title": "Культурный сет 1",
    "prompt": "Культура 07",
    "stmt_a": "Опера объединяет музыку, драму и сценографию.",
    "stmt_b": "Верди и Моцарт писали оперы.",
    "stmt_c": "Опера — это способ окраски стен.",
    "lie_option": "C",
    "explanation": "Опера — жанр сценического искусства.",
    "correct_fact": "Опера не относится к ремонту.",
    "trap_type": "scope_shift",
    "difficulty": 1,
    "source_url": null
  },
  {
    "topic": "culture",
    "topic_name": "Культура и медиа",
    "question_set": "culture-rotation-1",
    "question_set_title": "Культурный сет 1",
    "prompt": "Культура 08",
    "stmt_a": "Диего Ривера создавал монументальные фрески.",
    "stmt_b": "Фрида Кало известна автопортретами.",
    "stmt_c": "Их творчество развивалось исключительно в Арктике.",
    "lie_option": "C",
    "explanation": "Мексиканские художники работали в Латинской Америке.",
    "correct_fact": "Художники творили в Мексике и США, а не на полюсах.",
    "trap_type": "scope_shift",
    "difficulty": 1,
    "source_url": null
  },
  {
    "topic": "culture",
    "topic_name": "Культура и медиа",
    "question_set": "culture-rotation-1",
    "question_set_title": "Культурный сет 1",
    "prompt": "Культура 09",
    "stmt_a": "Пабло Пикассо участвовал в создании кубизма.",
    "stmt_b": "Жорж Брак экспериментыровал с формой.",
    "stmt_c": "Кубизм основан на строгом соблюдении линейной перспективы.",
    "lie_option": "C",
    "explanation": "Кубисты намеренно разрушали традиционную перспективу.",
    "correct_fact": "Кубизм отвергал классическую перспективу.",
    "trap_type": "definition",
    "difficulty": 1,
    "source_url": null
  },
  {
    "topic": "culture",
    "topic_name": "Культура и медиа",
    "question_set": "culture-rotation-1",
    "question_set_title": "Культурный сет 1",
    "prompt": "Культура 10",
    "stmt_a": "Балет «Лебединое озеро» написал Чайковский.",
    "stmt_b": "Русские сезоны Дягилева популяризировали балет в Париже.",
    "stmt_c": "Балетные спектакли проходят только на футбольных стадионах без музыки.",
    "lie_option": "C",
    "explanation": "Балет ставят на сцене под музыку.",
    "correct_fact": "Балеты исполняют в театрах с оркестром.",
    "trap_type": "scope_shift",
    "difficulty": 1,
    "source_url": null
  },
  {
    "topic": "culture",
    "topic_name": "Культура и медиа",
    "question_set": "culture-rotation-1",
    "question_set_title": "Культурный сет 1",
    "prompt": "Культура 11",
    "stmt_a": "Голливуд стал центром киноиндустрии США.",
    "stmt_b": "Оскар — престижная кинопремия.",
    "stmt_c": "Киноакадемия вручает награды на футбольном поле во время матча.",
    "lie_option": "C",
    "explanation": "Церемония проходит в театрах и павильонах.",
    "correct_fact": "Оскары вручают в залах, а не на поле.",
    "trap_type": "scope_shift",
    "difficulty": 1,
    "source_url": null
  },
  {
    "topic": "culture",
    "topic_name": "Культура и медиа",
    "question_set": "culture-rotation-1",
    "question_set_title": "Культурный сет 1",
    "prompt": "Культура 12",
    "stmt_a": "Аниме — японская анимация.",
    "stmt_b": "Манга — японские комиксы.",
    "stmt_c": "Аниме — это вид древесных пород.",
    "lie_option": "C",
    "explanation": "Аниме относится к мультфильмам, а не к древесине.",
    "correct_fact": "Термин описывает анимацию.",
    "trap_type": "definition",
    "difficulty": 1,
    "source_url": null
  },
  {
    "topic": "culture",
    "topic_name": "Культура и медиа",
    "question_set": "culture-rotation-1",
    "question_set_title": "Культурный сет 1",
    "prompt": "Культура 13",
    "stmt_a": "Хип-хоп появился в Нью-Йорке.",
    "stmt_b": "Граффити стало частью культуры хип-хопа.",
    "stmt_c": "Хип-хоп возник на королевских балах XVIII века.",
    "lie_option": "C",
    "explanation": "Жанр сформировался в 1970-х годах.",
    "correct_fact": "Хип-хоп возник в Бронксе во второй половине XX века.",
    "trap_type": "timeline",
    "difficulty": 1,
    "source_url": null
  },
  {
    "topic": "culture",
    "topic_name": "Культура и медиа",
    "question_set": "culture-rotation-1",
    "question_set_title": "Культурный сет 1",
    "prompt": "Культура 14",
    "stmt_a": "Бродвей известен мюзиклами.",
    "stmt_b": "Мюзикл объединяет музыку, танец и сюжет.",
    "stmt_c": "Мюзиклы исполняют только под открытым небом на Северном полюсе.",
    "lie_option": "C",
    "explanation": "Спектакли играют в театрах разных стран.",
    "correct_fact": "Мюзиклы ставят на сценах, а не на полюсе.",
    "trap_type": "scope_shift",
    "difficulty": 1,
    "source_url": null
  },
  {
    "topic": "culture",
    "topic_name": "Культура и медиа",
    "question_set": "culture-rotation-1",
    "question_set_title": "Культурный сет 1",
    "prompt": "Культура 15",
    "stmt_a": "«Звёздные войны» — культовая космическая сага.",
    "stmt_b": "Джордж Лукас создал оригинальную трилогию.",
    "stmt_c": "Первый фильм снимали в XVIII веке.",
    "lie_option": "C",
    "explanation": "Лента вышла в 1977 году.",
    "correct_fact": "Премьера фэнтези состоялась в конце XX века.",
    "trap_type": "timeline",
    "difficulty": 1,
    "source_url": null
  },
  {
    "topic": "culture",
    "topic_name": "Культура и медиа",
    "question_set": "culture-rotation-1",
    "question_set_title": "Культурный сет 1",
    "prompt": "Культура 16",
    "stmt_a": "Болливуд выпускает фильмы на хинди.",
    "stmt_b": "Индийское кино славится танцевальными сценами.",
    "stmt_c": "Болливуд — сеть булочных.",
    "lie_option": "C",
    "explanation": "Болливуд — киноиндустрия.",
    "correct_fact": "Название относится к кино, а не к выпечке.",
    "trap_type": "definition",
    "difficulty": 1,
    "source_url": null
  },
  {
    "topic": "culture",
    "topic_name": "Культура и медиа",
    "question_set": "culture-rotation-1",
    "question_set_title": "Культурный сет 1",
    "prompt": "Культура 17",
    "stmt_a": "Комиксы Marvel популяризовали супергероев.",
    "stmt_b": "Кинематограф MCU строится на общей вселенной.",
    "stmt_c": "Iron Man дебютировал в немом кино 1910-х годов.",
    "lie_option": "C",
    "explanation": "Персонаж появился в комиксах 1960-х, фильмы вышли позже.",
    "correct_fact": "Железный человек не снимался в немом кино.",
    "trap_type": "timeline",